,id,주류,중분류,주류명,생산국가,생산자/제조사,포도품종,주원료,용량,도수,음용온도,추천음식,특징,당도,바디,산도,타닌,맛
1063,1064,브랜디/꼬냑,,꼬띠에르 EXTRA 1755,프랑스,,,,700,40.0,,,1755년부터 최상의 숙성조건중의 하나인 최적의 습도를 위해 강 위에 저장고를 지어 숙성해왔습니다. 1755년에 설립되어 250년 전통의 꼬띠에르는 가장 오래된 꼬냑 회사중 하나 입니다.  창사 250주년 기념으로 꼬띠에르 가문은 자사의 설립자인 Louis Gautier를 기년하기 위해서  1755 라는 이름의 꼬냑을 한정 생산 했습니다. 가문의 Paradis 와인 저장고에서 아주 오랫동안 숙성된 꼬띠에르 Extra는 250년 꼬띠에르가의 전통과 명예가 깃든 명품입니다. 화려한 황금색의 로고와 1755의 숫자는 장인의 자부심을 전해줍니다. 진정 소중한 분을 위한 가치있는 선물이 될 것입니다.45,,,,,
1064,1065,브랜디/꼬냑,,꼬띠에르vs,프랑스,,,,700,40.0,,,젊고 균형이 잘 잡힌 미각 꼬띠에르 vs는 얼음과 물로 믹싱해서 즐기는 단순하고 깔끔한 이상적인 술 입니다. 꼬냑협회에서 법으로 정한 숙성년도를 2배이상 더 숙성시킴으로 매년 주류 품평회에서 메달을 수상해왔습니다. 특히 2010년 IWSC 국제주류평가대회 에서는 은메달을 수상하였읍니다.,,,,,
1065,1066,브랜디/꼬냑,,꼬띠에르VSOP,프랑스,,,,750,40.0,,,꼬띠에르 VSOP는 핀 꼬냑 중에서도 시중의 대량생산 꼬냑과 다르게 소규모로 꼬띠에르 가문에서 엄선하여 생산하는 제품으로 품질의 우수성과 향의 우아함으로 매년 국제 대회에서 메달을 수상하는 꼬냑입니다. 꼬냑 협회에서 법으로 정한 숙성년도를 2배이상 더 숙성시킴으로 부드럽고 진한 여운을 남깁니다.,,,,,
1066,1067,브랜디/꼬냑,,꼬띠에르xo,프랑스,,,,700,40.0,,,블루 강위에 있는 Gautier하우스. Gautier 하우스는 18세기 에 강위에 저장고를 만들어 꼬냑이 숙성하는데 최적의 조건을 갖추고 있습니다. 매년 주류대회에서 수상하는 영광을 누려왔고 특히 2009년 더블골드메달 획득 2010년 IWSC 금메달 획득으로 세계가 인정하는 꼬냑입니다.강한 태양과 비 바람을 견디고 또 수십년 오크통에서 손길을 기다려온 꼬띠에르XO 는 그 우아한 병에 깃든 250년의 전통과 명예 그리고 장인 정신을 느낄 수 있습니다.25,,,,,
1067,1068,브랜디/꼬냑,,꼬띠에르램프XO,프랑스,,,,700,40.0,,,"이 랜턴은 컬렉션 애호가들에게 많은 사랑을 받고 있는 제품이다. 꼬띠에르 XO는 꼬냑 위원회의 규정보다 2배이상 더 숙성시켜 진한 황금색 그리고 숙성된 과일의 향기와 바닐라향의 완벽하고 미묘한 조화, 절제된 균형이믜 꼬냑, 입안에서 의 부드러움과 은은한 여운,온더락 여부와 상관 없는 신선한 풍미를 느낄 수 있습니다.",,,,,
1068,1069,브랜디/꼬냑,,꽁뜨 루이스 X.O,프랑스,,,,700,40.0,,,우아한 디자인과 어느 하나 치우치지 않는 완벽한 발란스와 깊고 부드러운 목넘김이 일품 럭셔리한  브랜디 입니다,,,,,
1069,1070,브랜디/꼬냑,,꾸부와제vsop,프랑스,,,,1000,40.0,,," 장미나 제비꽃을 연상케 하는 꽃향기, 상쾌하며 화려한 맛을 가진다.Courvoisier VSOP (Very Superior Old Pale)is an elegant and sensual blend of cognacs up to 10 years old from two of the finest crus in the Cognac region. It’s been expertly crafted using a minimum of 50 Grande Champagne grapes blended exclusively with Petite Champagne grapes, entitling it to carry the prestigious ‘Fine Champagne’ designation.75",,,,,
1070,1071,브랜디/꼬냑,,꾸부와제XO,프랑스,,,,700,40.0,,,"Courvoisier는 세계 4대 코냑 하우스 중 하나입니다. 전설에 따르면 나폴레옹 황제 자신이 선호하는 코냑으로 쿠르부아지에를 선택했기 때문에 쿠르부아지에는 종종 ""나폴레옹의 코냑""이라고 불립니다. 이 회사는 1828년으로 거슬러 올라가며 그 이후로 Jarnac 마을에 본사가 있습니다. Courvoisier Napoleon 또는 Josephine과 같은 고급 병으로 코냑 하우스는 고급 주류 시장의 선두에 있습니다.",,,,,
1071,1072,브랜디/꼬냑,,꿀레르블루 XO,프랑스,,,,1000,40.0,,,모든 공정이 수공예로 이루어진 최고급 도자기 제품이며제품의 라인을 영국산 금을 원료로 도예명장이 심혈을 기울여 하나 하나 핸드페인팅하여 다시 1000도의 고열로 가열하여 금장의 느낌이 한층밝고 고급스럽습니다.제품을 300병만 한정제작 수입하여 희소가치및 소장품으로서의 가치를 높였읍니다.,,,,,
1072,1073,브랜디/꼬냑,,끌레드 듀크VSOP,프랑스,,,,700,40.0,,,아르마냑 지역에서 생산된 제품으로 오래된 포도나무에서 수확한 포도로만 증류 최고급 오크통숙성으로 짙은 풍미와 입안에서 감도는 다양한 부드러운 맛을 극대화한 제품으로 초코렛향과 풍부한 아로마향이 어울어졌다.,,,,,
1073,1074,브랜디/꼬냑,,끌레르화이트,프랑스,,,,700,40.0,,,"독특한 디자인의 크리스탈 예술품1847년  Jules Gautret가 설립한 유니꼬냑사의 제품 쁘띠뜨샹파뉴 지역 최고품질의 포도로 생산된 꼬냑오랜기간 리무진오크통에서 숙성시킨 원액중에서 엄선하여 생산 되었으며,과일향이 많이 나는 부드러운 맛이 특징",,,,,
1074,1075,브랜디/꼬냑,,나폴레옹,프랑스,,,,700,40.0,,,"화려한 황금색의 섬세하고 우아한 과일향과 오크향을 함께 느낄수 있으며,입안 가득 꽉찬 느낌을 주는 브랜디.",,,,,
1075,1076,브랜디/꼬냑,,나폴레옹XO,프랑스,,,,700,40.0,,,나폴레옹의 중후한 디장인과 리무진 오크통에서 오랜시간 숙성한 원액을 브랜딩하여 화려함과 부드러움을 느끼게 해주고  장식장에 보관해도 잘 어울리는 브랜디 입니다.,,,,,
1076,1077,브랜디/꼬냑,,니콜레트 엑스트라꼬냑,프랑스,,,,650,40.0,,,"독특한 디자인의 크리스탈 예술품1847년  Jules Gautret가 설립한 유니꼬냑사의 제품 쁘띠뜨샹파뉴 지역 최고품질의 포도로 생산된 꼬냑오랜기간 리무진오크통에서 숙성시킨 원액중에서 엄선하여 생산 되었으며, 부드럽고 바이올렛향이 풍부한 프리미엄 꼬냑.",,,,,
1077,1078,브랜디/꼬냑,,다니엘 부쥬 vsop,프랑스,,,,680,40.0,,,,,,,,
1078,1079,브랜디/꼬냑,,다니엘 부쥬xo,프랑스,,,,700,40.0,,,,,,,,
1079,1080,브랜디/꼬냑,,다니엘 부즈 로얄 꼬냑,프랑스,,,,700,60.0,,,새로운 오크 배럴 리무진에서 15년이상 숙성된 꼬냑,,,,,
1080,1081,브랜디/꼬냑,,다니엘 브쥬 브룻 드 풋,프랑스,,,,700,50.0,,,40년 이상 숙성된 꼬냑,,,,,
1081,1082,브랜디/꼬냑,,다비드XO  ,프랑스,,,,700,40.0,,,오크통에서 포도원액을 장기숙성 정제시킨 브랜디이며 입안에서는 부드럽고 감칠 맛 나는 향을 느낄수 있다.,,,,,
1082,1083,브랜디/꼬냑,,닥스XO,프랑스,,,,700,40.0,,,,,,,,
1083,1084,브랜디/꼬냑,,듀끌로XO,프랑스,,,,700,40.0,,,,,,,,
1084,1085,브랜디/꼬냑,,듀베론레이디XO ,프랑스,,,,700,40.0,,,,,,,,
1085,1086,브랜디/꼬냑,,드래곤 용 X.O,프랑스,,,,700,40.0,,,,,,,,
1086,1087,브랜디/꼬냑,,드리옹XO,프랑스,,,,700,40.0,,,"프랑스산 리부진 오크통에서 숙성시켜 진한 호박색과 바닐라 향의 균형이 조화된 정통 프랑스산 브랜디.오랜 시간 동안 오크 배럴에서 숙성하여 프렌치 브랜디의 시그니쳐인 조화롭고 부드러운 깔끔한 맛과 섬세하면서도 달콤한 향기, 매력적인 럭셔리 풍미에 화려한 황금빛 주정이 섬세하고 우아한 과일과 오크향은 물론 입안을 가득 채우는 충만한 풍미가 있습니다.",,,,,
1087,1088,브랜디/꼬냑,,드마쉬 ,프랑스,,,,700,40.0,,,"풍부하면서도 부드러운 향과 맛이 오크숙성을 거치면서 조금 더 세련되어지고 한층 더 깊고 우아한 풍미를 가진 프랑스 고급 브랜디, 입안을 꽉 채운듯한 바디감이 인상적이다.",,,,,
1088,1089,브랜디/꼬냑,,드세이XO,프랑스,,,,700,40.0,,,"프랑스산 리부진 오크통에서 숙성시켜 진한 호박색과 바닐라 향의 균형이 조화된 정통 프랑스산 브랜디.오랜 시간 동안 오크 배럴에서 숙성하여 프렌치 브랜디의 시그니쳐인 조화롭고 부드러운 깔끔한 맛과 섬세하면서도 달콤한 향기, 매력적인 럭셔리 풍미에 화려한 황금빛 주정이 섬세하고 우아한 과일과 오크향은 물론 입안을 가득 채우는 충만한 풍미가 있습니다.",,,,,
1089,1090,브랜디/꼬냑,,라리저브,프랑스,,,,700,40.0,,,가격:58000특판할인: 최저가격문의선별된 포도로 양조한 와인을 증류하여 생산한 프랑스산 브랜디로 오크 숙성을 통한 바닐라 향과 은은한 나무향이 느껴지는 매혹적인 풍미가 특징.,,,,,
1090,1091,브랜디/꼬냑,,라센골드바이킹XO,프랑스,,,,700,40.0,,,라센바이킹 배시리즈는 매년 양주 선물 시즌에 수집가들에게는 최고의 선물로 꼽힌다. 최고급 꼬냑지역 중에 하나인 그랑드와 쁘띠뜨 상파뉴 꼬냑을 블랜딩한 뛰어난 제품이다. 입안 가득 퍼지는 Extra급 꼬냑의 맛은 가히 형용할 수 없을 정도로 부드럽고 은은하다. 도자기병 외부의 금장식은 모두 24K 금으로 수공예 장식이 되어 화려함과 고급스러움은 절정에 달한다.,,,,,
1091,1092,브랜디/꼬냑,,라센바이킹블루XO,프랑스,,,,700,40.0,,,"라센은 자가 소유의 포도 농장을 가지지 않은 순수한 블렌드 업자이다. 원액은 그랜드 샹파뉴, 프티드 샹파뉴, 팬 보어의 3지구에서 구입하고, 자사에서 숙성, 블렌드해서 상품화하고 있다.위의 VSOP는 기분좋은 향을 가지면서도 뒷맛이 감미롭다.그랜드 피누 샹퍄뉴와 그랜드 샹파뉴는 모두 꼬냑 최고의 원액 생산 지구인 그랜드 샹파뉴의 원액을 천천히 숙성시킨 것이데, 피누라는 말이 붙은 것이 순하다. 붙지 않은 것은 방향은 섬세하지만 맛이 진하다.나폴레옹은 그랜드 샹파뉴 원액을 중심으로 한 블렌드. 숙성감과 풍미의 조화가 우수하다.XO는 나폴레옹보다 숙성감이 깊은 원액을 사용한 것. 장기 숙성에 의한 은은한 향을 즐길 수 있도록 블렌드한 것.익스트라는 동사의 제품으로서는 중후하며, 전통적인 맛을 가진 고급품.바카라 데칸터는 동사 저장의 비장 고주를 이용한 숙성감이 풍부한 술.도자기제 화장병에는 나폴레옹 급의 술을 넣고 있다.",,,,,
1092,1093,브랜디/꼬냑,,라파엘XO,프랑스,,,,700,40.0,,,"라파엘XO용량: 700알콜도수:40산지: 프랑스가격:100,000특판할인:가격문의",,,,,
1093,1094,브랜디/꼬냑,,라헨느EXTRA  ,프랑스,,,,700,40.0,,,"쁘띠뜨샹파뉴 지역 최고품질의 포도로 생산된 꼬냑오랜기간 리무진오크통에서 숙성시킨 원액중에서 엄선하여 생산 되었으며, 부드럽고 바이올렛향이 풍부한 프리미엄 꼬냑.화려한 금장이 둘러쳐 있어 더욱 아름답다.",,,,,
1094,1095,브랜디/꼬냑,,레미마틴,프랑스,,,,800,40.0,,,"레미마르땡 가문의 무한한 영광의 상징인 그리스 신화의 반수반인 센토. 세계적인 요업대가인 리무진의 베르나르(Barnard)사에 의해 재현시킨 리모쥬는 특수도자기와 함께 예술적 극치를 이룬 제품으로 애호가들이 한번쯤 소장하고픈 제품입다. 핀샹파뉴 꼬냑은 꼬냑 지방에서도 최상급 지역으로 전체의 10에 불과한 그랑 샹파뉴와 쁘띠 샹파뉴 두 지역의 최고급 포도만을 엄선해 제조되며,특히 최상급에 속하는 그랑 샹파뉴 지역의 포도주 증류액이 50이상 섞여있는 꼬냑을 말합니다.콜렉션 애호가들에게 디자인이 남성적인 기상과 힘을 감상할 수 있는 훌륭한 제품이며선물용으로 좋습니다.",,,,,
1095,1096,브랜디/꼬냑,,레미마틴EXTRA,프랑스,,,,700,40.0,,,,,,,,
1096,1097,브랜디/꼬냑,,레미마틴VSOP,프랑스,,,,700,40.0,,,"꼬냑생산의 최적지로 평가받고 있는 그랑 샹파뉴와 쁘띠 샹파뉴 두지역에서 생산된 핀 샹파뉴 꼬냑만을 사용하여,황금빛 호박색,부드럽고 복잡하면서도 균형 잡힌 맛이 완벽하게 조화되어 있으며,전세계에서 판매되는 V.S.O.P꼬냑 세병 중 하나가 레미마르땡이라는 명성을 갖고 있습니다",,,,,
1097,1098,브랜디/꼬냑,,레미마틴XO,프랑스,,,,700,40.0,,,"프랑스레미(Remy)사는 1724년 창업된 회사로 오제(Aug), 고띠에르(Gauthier), 마텔(Mattel) 다음으로 오래된 회사라 할 수 있다. 동사는 그랑 샹파뉴(Grande Champagne), 프리트 샹파뉴(Frites Champagne) 지구 이외에서 생산된 원액을 일체 사용하지 않아서 제품 전체가 리누 샹파뉴(Champagne)나 그랑 샹파뉴(Grande Champagne)의 이름이 붙게 되었다. XO 스페셜은 평균주령 30년 이상의 리누 샹파뉴(Champagne) 규격품으로 뒷맛이 오래 남는다.핀 샹파뉴 레미마르땡의 상징으로 꼬냑 지방의 최상급 지방인 그랑 샹파뉴(85)와쁘띠 샹퍄뉴(15) 지역의 최고급 원액만을 블랜딩하여 최고 37년까지 숙성하여탄생되는X.O 꼬냑의 거장입니다.",,,,,
1098,1099,브랜디/꼬냑,,레미마틴루이13세,프랑스,,,,700,40.0,,,레미 마르탱이 생산하는 코냑 가운데 최고로 치는 코냑은 ‘루이 13세’ 100 그랑 샹파뉴 포도로 만들어지는 명품이어서 ‘그랑 샹파뉴의 긍지’라고도 불린다. 루이 13세 코냑에는 40∼100년간 숙성된 1200여 가지의 코냑 원액이 섞인다.,,,,,
1099,1100,브랜디/꼬냑,,레오XO,프랑스,,,,700,40.0,,,오크통에서 포도원액을 8년동안 숙성 정제시킨 브랜디이면 입안에서는 부드럽고 감칠 맛 나는 향을 느낄수 있다.,,,,,
1100,1101,브랜디/꼬냑,,레오폰드라핀,프랑스,,,,700,40.0,,,"프랑스산 리부진 오크통에서 숙성시켜 진한 호박색과 바닐라 향의 균형이 조화된 정통 프랑스산 브랜디.오랜 시간 동안 오크 배럴에서 숙성하여 프렌치 브랜디의 시그니쳐인 조화롭고 부드러운 깔끔한 맛과 섬세하면서도 달콤한 향기, 매력적인 럭셔리 풍미에 화려한 황금빛 주정이 섬세하고 우아한 과일과 오크향은 물론 입안을 가득 채우는 충만한 풍미가 있습니다.",,,,,
1101,1102,브랜디/꼬냑,,레오폰드라핀XO,프랑스,,,,1000,40.0,,,,,,,,
1102,1103,브랜디/꼬냑,,로렌트X.O,프랑스,,,,1000,40.0,,,장인의 손길로 제조한 풍부한 오크향과 은은한 나무향이 특징인 부드러운 프랑스산 브랜디.,,,,,
1103,1104,브랜디/꼬냑,,로버트 듀쉬멩,프랑스,,,,700,40.0,,,"프랑스산 리부진 오크통에서 숙성시켜 진한 호박색과 바닐라 향의 균형이 조화된 정통 프랑스산 브랜디.오랜 시간 동안 오크 배럴에서 숙성하여 프렌치 브랜디의 시그니쳐인 조화롭고 부드러운 깔끔한 맛과 섬세하면서도 달콤한 향기, 매력적인 럭셔리 풍미에 화려한 황금빛 주정이 섬세하고 우아한 과일과 오크향은 물론 입안을 가득 채우는 충만한 풍미가 있습니다.",,,,,
1104,1105,브랜디/꼬냑,,로빈롯XO,프랑스,,,,700,40.0,,,,,,,,
1105,1106,브랜디/꼬냑,,로얄골드XO 추천상품,프랑스,,,,700,40.0,,,프랑스산 리무진 오크통에서 숙성시켜 진한 호박색과 바닐라 향의 균형이 조화된 정통 프랑스산 브랜디,,,,,
1106,1107,브랜디/꼬냑,,로얄다이아몬드XO,프랑스,,,,700,40.0,,,프랑스산 브랜디로 독특한 디자인과 장식장에도 잘 어울리고 풍부한 과일향과 오크향이 조화로와 맛도 은은하다.,,,,,
1107,1108,브랜디/꼬냑,,로얄스타XO ,프랑스,,,,700,40.0,,,,,,,,
1108,1109,브랜디/꼬냑,,로얄킹X.O,프랑스,,,,700,40.0,,,리무진 오크통에서 장기 숙성하여 진한 쵸코렛빛깔과 부드럽고  중후한  맛을 느낄수 있는 정통 프랑스산 브랜디,,,,,
1109,1110,브랜디/꼬냑,,로얄킹덤EXTRA,프랑스,,,,700,40.0,,,마스터의 숙련된 블랜딩으로 깊으면서도 잘 조화된 향은 안정적이고 온화혀면서도 긴 여운을  남긴다. 제품으의 숙성은 리무진 오크통에서 숙성을 시키는데 리무진 오크는 루이14세 당시 재무장관이던 콜베르가 프랑스 해군의 전함을 만들기 위해 꼬냑 동부의 리무진 지역에 조성한 오크나무 숲에서 생산된다. 포도 품종은 위니블랑 품종을  주로 사용하며 골롱바르 휠 블랑슈로 만들어진 백포도주 만을 사용하며 샤랑트 방법으로 증류기에서 연속으로 2번 증류를 거쳐 만든다. 또한 제품에 사용된 도자기병은  하나 하나 수작업에 의하여 만들어진 제품으로 각 병마다 모두 다른 문향을 가지며 세계에서 단 하나뿐인 소장품으로서도 가치가 있다.,,,,,
1110,1111,브랜디/꼬냑,,로얄팰리스EXTRA,프랑스,,,,700,40.0,,,마스터의 숙련된 블랜딩으로 깊으면서도 잘 조화된 향은 안정적이고 온화혀면서도 긴 여운을  남긴다. 제품으의 숙성은 리무진 오크통에서 숙성을 시키는데 리무진 오크는 루이14세 당시 재무장관이던 콜베르가 프랑스 해군의 전함을 만들기 위해 꼬냑 동부의 리무진 지역에 조성한 오크나무 숲에서 생산된다. 포도 품종은 위니블랑 품종을  주로 사용하며 골롱바르 휠 블랑슈로 만들어진 백포도주 만을 사용하며 샤랑트 방법으로 증류기에서 연속으로 2번 증류를 거쳐 만든다. 또한 제품에 사용된 도자기병은  하나 하나 수작업에 의하여 만들어진 제품으로 각 병마다 모두 다른 문향을 가지며 세계에서 단 하나뿐인 소장품으로서도 가치가 있다.,,,,,
1111,1112,브랜디/꼬냑,,로얄프린스 XO,프랑스,,,,700,40.0,,,,,,,,
1112,1113,브랜디/꼬냑,,로얄하트XO,프랑스,,,,700,40.0,,,"프랑스산 리부진 오크통에서 숙성시켜 진한 호박색과 바닐라 향의 균형이 조화된 정통 프랑스산 브랜디.오랜 시간 동안 오크 배럴에서 숙성하여 프렌치 브랜디의 시그니쳐인 조화롭고 부드러운 깔끔한 맛과 섬세하면서도 달콤한 향기, 매력적인 럭셔리 풍미에 화려한 황금빛 주정이 섬세하고 우아한 과일과 오크향은 물론 입안을 가득 채우는 충만한 풍미가 있습니다.",,,,,
1113,1114,브랜디/꼬냑,,루비스XO ,프랑스,,,,700,40.0,,,"프랑스산 리부진 오크통에서 숙성시켜 진한 호박색과 바닐라 향의 균형이 조화된 ﻿정통 프랑스산 브랜디.오랜 시간 동안 오크 배럴에서 숙성하여 프렌치 브랜디의 시그니쳐인 조화롭고 부드러운 깔끔한 맛과 섬세하면서도 달콤한 향기, 매력적인 럭셔리 풍미에 화려한 황금빛 주정이 섬세하고 우아한 과일과 오크향은 물론 입안을 가득 채우는 충만한 풍미가 있습니다.  특히 술잔을 채웠을때 형형색깔의 아름다음 빛이 나와 마시는 즐거움을 줍니다.",,,,,
1114,1115,브랜디/꼬냑,,루이11세XO  ,프랑스,,,,700,40.0,,,"풍부하면서도 부드러운 향과 맛이 오크숙성을 거치면서 조금 더 세련되어지고 한층 더 깊고 우아한 풍미를 가진 프랑스 고급 브랜디, 입안을 꽉 채운듯한 바디감이 인상적이다.",,,,,
1115,1116,브랜디/꼬냑,,루이12세XO,프랑스,,,,700,40.0,,,포도 원액을 브랜딩 오드비로 인한 아로마향은 풍부하고 부드럽다. 전통기법으로 제조된 브랜디이며 우아한 디자인의 바틀과의 조화가 고급스럽다,,,,,
1116,1117,브랜디/꼬냑,,루이14세XO,프랑스,,,,700,40.0,,,프랑스 전통기법으로 제조된 브랜디며 심플한 현대적 디자인의 디켄터가 고급스러움을 더하고 오크향과 과일향이 조화롭다.,,,,,
1117,1118,브랜디/꼬냑,,루이16세XO,프랑스,,,,700,40.0,,,프랑스산 리무진 오크통에서 숙성시켜 진한 호박색과 바닐라 향의 균형이 조화된 정통 프랑스산 브랜디.,,,,,
1118,1119,브랜디/꼬냑,,루이16세XO,프랑스,,,,700,40.0,,,"프랑스산 리부진 오크통에서 숙성시켜 진한 호박색과 바닐라 향의 균형이 조화된 정통 프랑스산 브랜디.오랜 시간 동안 오크 배럴에서 숙성하여 프렌치 브랜디의 시그니쳐인 조화롭고 부드러운 깔끔한 맛과 섬세하면서도 달콤한 향기, 매력적인 럭셔리 풍미에 화려한 황금빛 주정이 섬세하고 우아한 과일과 오크향은 물론 입안을 가득 채우는 충만한 풍미가 있습니다.",,,,,
1119,1120,브랜디/꼬냑,,루이스 EXTRA,프랑스,,,,700,40.0,,,"프랑스산 리부진 오크통에서 숙성시켜 진한 호박색과 바닐라 향의 균형이 조화된 정통 프랑스산 브랜디.장식용으로도 우아하고 세련된 병모양으로 오랜 시간 동안 오크 배럴에서 숙성하여 프렌치 브랜디의 시그니쳐인 조화롭고 부드러운 깔끔한 맛과 섬세하면서도 달콤한 향기, 매력적인 럭셔리 풍미에 화려한 황금빛 주정이 섬세하고 우아한 과일과 오크향은 물론 입안을 가득 채우는 충만한 풍미가 있습니다.",,,,,
1120,1121,브랜디/꼬냑,,루이스골드 임페리얼XO,프랑스,,,,700,40.0,,,오래된 포도나무에서 수확한 포도로만 증류  최상급의 리무진 오크농에서 숙성으로 짙은 풍미와 입안에서 감도는 다양한 부드러운 맛을 극대화한 브랜디. 특히 세미크리스탈 병에 병입하여 고급스러움을 더했다.,,,,,
1121,1122,브랜디/꼬냑,,루이스골드XO,프랑스,,,,700,40.0,,,,,,,,
1122,1123,브랜디/꼬냑,,루이스골드에펠XO,프랑스,,,,700,40.0,,,꼬냑과 같이 특수 증류기로 두번 증류하여 최상급 리무진 오크통에서 숙성시켜 진한 호박색과 바닐라향의 균형이 조화된 정통 프라스산 브랜디 입니다.특히 세미크리스탈병에 병입하여 고급스러움을 더했다.,,,,,
1123,1124,브랜디/꼬냑,,루이스로얄extra,프랑스,,,,700,40.0,,,꼬냑과 같이 특수 증류기로 2번 증류하여 프랑스산  리무진 오크통에서 숙성시켜 진한  호박색과 바닐라향의 균형이 조화된 정통 프랑스산 브랜디 입니다,,,,,
1124,1125,브랜디/꼬냑,,루이스로얄엑스트라,프랑스,,,,700,40.0,,,꼬냑과 같이 특수 증류기로 두번 증류하여 프랑스산 리무진 오크통에서 숙성시켜 진한 호박색과 바닐라향의 균형이 조화된 정통 프랑스산 브랜디입니다.,,,,,
1125,1126,브랜디/꼬냑,,루이스부르넬XO,프랑스,,,,750,40.0,,,"프랑스산 리부진 오크통에서 숙성시켜 진한 호박색과 바닐라 향의 균형이 조화된 정통 프랑스산 브랜디.오랜 시간 동안 오크 배럴에서 숙성하여 프렌치 브랜디의 시그니쳐인 조화롭고 부드러운 깔끔한 맛과 섬세하면서도 달콤한 향기, 매력적인 럭셔리 풍미에 화려한 황금빛 주정이 섬세하고 우아한 과일과 오크향은 물론 입안을 가득 채우는 충만한 풍미가 있습니다.",,,,,
1126,1127,브랜디/꼬냑,,루치아XO,프랑스,,,,700,40.0,,,"프랑스산 리부진 오크통에서 숙성시켜 진한 호박색과 바닐라 향의 균형이 조화된 정통 프랑스산 브랜디.오랜 시간 동안 오크 배럴에서 숙성하여 프렌치 브랜디의 시그니쳐인 조화롭고 부드러운 깔끔한 맛과 섬세하면서도 달콤한 향기, 매력적인 럭셔리 풍미에 화려한 황금빛 주정이 섬세하고 우아한 과일과 오크향은 물론 입안을 가득 채우는 충만한 풍미가 있습니다.",,,,,
1127,1128,브랜디/꼬냑,,르네상스XO,프랑스,,,,700,38.0,,,"리부진 오크통에서 숙성시켜 진한 호박색과 바닐라 향의 균형이 조화된 정통 프랑스산 브랜디.오랜 시간 동안 오크 배럴에서 숙성하여 프렌치 브랜디의 시그니쳐인 조화롭고 부드러운 깔끔한 맛과 섬세하면서도 달콤한 향기, 매력적인 럭셔리 풍미에 화려한 황금빛 주정이 섬세하고 우아한 과일과 오크향은 물론 입안을 가득 채우는 충만한 풍미가 있습니다.​ ​",,,,,
1128,1129,브랜디/꼬냑,,리발넷NP,프랑스,,,,700,40.0,,,,,,,,
1129,1130,브랜디/꼬냑,,리비에도EXTRA,프랑스,,,,700,40.0,,,"독특한 디자인의 크리스탈 디컨더가 고급스러움을 더하며 유니꼬냑사의 제품으로 쁘띠뜨 상파뉴 지역의 최고 품질의 포도로 생산된 꼬냑을 사용한다. 오랜 기간 리무진 오크통에서 숙성시킨 원액 중에서 엄선하여 생산 되며 ,한병의 꼬냑이 탄생하기 까지 오랜 시간이 걸리는 이제품은 권위와 품위를 상진하는 최고의 수퍼프리미엄 꼬냑이다.",,,,,
