,id,주류,중분류,주류명,생산국가,생산자/제조사,포도품종,주원료,용량,도수,음용온도,추천음식,특징,당도,바디,산도,타닌,맛
390,391,와인,레드,"마리에따, 크리스토",미국,마리에따 셀라 Marietta Cellars,"시라/쉬라즈 (Syrah/Shiraz) 64%, 그르나슈 (Grenache) 23%, 쁘띠 시라 (Petite Sirah) 7%, 비오니에 (Viognier) 6%",,750,15.2,17~19 ℃,"그릴에 구운 양고기, 크림 파스타 등과 잘 어울린다.",,1.0,4.0,2.0,1.0,바디 산도 
391,392,와인,레드,"마리타나 빈야즈, 젠킨스 랜치 싱글 빈야드 피노 누아",미국,마리타나 빈야즈 Maritana Vineyards,피노 누아 (Pinot Noir),,750,14.5,14~16 ℃,"양꼬치, 바비큐, 보쌈, 훈제오리, 불고기, 편육, 모짜렐라, 리코타와 잘 어울린다.",,1.0,4.0,5.0,4.0,바디 산도 타닌 
392,393,와인,레드,마오루,프랑스,플로 드 마오루 Plo de Maorou,"시라/쉬라즈 (Syrah/Shiraz) 38%, 그르나슈 (Grenache) 24%, 까리냥 (Carignan/Carignane) 38%",,750,14.5,16~18 ℃,약간 기름진 음식 등과 잘 어울린다.,,1.0,0.0,3.0,2.0,산도 타닌 
393,394,와인,레드,"마이클 포잔, 욘트 밀 하우스 피노 누아",미국,마이클 포잔 Michael Pozzan,피노 누아 (Pinot Noir) 100%,,750,14.0,14~16 ℃,구운 연어와 간단한 비네그레트와 염소 치즈로 장식된 샐러드와 잘 어울린다.,,1.0,3.0,4.0,3.0,바디 산도 타닌 
394,395,와인,화이트,마투아 랜드 & 레전드 소비뇽 블랑,뉴질랜드,마투아 Matua,소비뇽 블랑 (Sauvignon Blanc) 100%,,750,12.0,8~10 ℃,식사 전후의 에피타이져와 디져트와 잘 어울린다.,,1.0,3.0,3.0,2.0,바디 산도 타닌 
395,396,와인,레드,"매티스, 그르나슈",미국,매티스 와이너리 Mathis Winery,"그르나슈 (Grenache) 82%, 까리냥 (Carignan/Carignane) 10%, 쁘띠 시라 (Petite Sirah) 6%, 알리칸테 부쉐 (Alicante Bouschet) 2%",,750,14.0,16~18 ℃,"덩어리 째 오븐에 구운 육류와 햄, 스테이크, 라자냐, 치즈 등과 잘 어울린다.",,1.0,4.0,2.0,1.0,바디 산도 
396,397,와인,화이트,"메종 카스텔, 소비뇽 블랑",프랑스,메종 카스텔 Maison Castel,소비뇽 블랑 (Sauvignon Blanc),,750,13.0,8~10 ℃,"연어 타르타르 스테이크와 같은 해산물 요리, 샐러드와 같은 야채, 생선 그릴 요리와 잘 어울린다.",,1.0,3.0,4.0,5.0,바디 산도 타닌 
397,398,와인,스파클링,"메종 카스텔, 퀴베 블랑쉬 브뤼",프랑스,메종 카스텔 Maison Castel,샤르도네 (Chardonnay),,750,11.0,6~8 ℃,"디저트, 조개, 생선 요리 또는 반주와 잘 어울린다.",,1.0,4.0,1.0,1.0,바디 
398,399,와인,화이트,"메종 카스텔, 푸이 퓌메",프랑스,메종 카스텔 Maison Castel,소비뇽 블랑 (Sauvignon Blanc),,750,13.0,8~10 ℃,"샤프란을 곁들인 생선 스튜 요리 등 생선, 갑각류, 조개 요리, 크림 소스를 곁들인 가금류 요리와 잘 어울린다.",,1.0,4.0,1.0,1.0,바디 
399,400,와인,화이트,"멜쉐이머, 리슬링 파인헤릅",독일,바인굿 멜쉐이머 Weingut Melsheimer,리슬링 (Riesling) 100%,,750,10.5,8~10 ℃,"베이컨, 꼬치구이, 해산물, 양념치킨, 하몽, 살라미, 아시아요리, 매운음식, 동남아요리등과 잘 어울린다.",,1.0,4.0,1.0,1.0,바디 
400,401,전통주,탁주,입장탁주,대한민국,(농) 입장주조㈜,,국내산 쌀,750,7.0,10 ℃,"매운음식 및 한식류, 버섯 전골류와 잘 어울린다",쌀을 익히지 않고 자연그대로 발효시키는 생쌀발효법으로 만들어진 생막걸리로 순수쌀 100%로 빚은 술이다. 9~10일간 저온발효하여 숙취와 트림이 나는 막걸리의 단점을 최소화시켰으며 불로 쪄서 만드는 과정에 파괴될 수 있는 영양소를 최소화시켜 영양분이 살아있다. 부드러운 목 넘김과 입안에 남는 잔향이 없어 깔끔한 맛을 느낄 수 있다.,2.0,2.0,2.0,0.0,당도 바디 산도 
401,402,전통주,증류주,톡 한잔 소주,대한민국,(농)(유)대마주조,,"국내산 보리, 쌀",750,30.0,8~10 ℃,"두부전골, 삼계탕","톡 한잔 소주는 보리로 누룩을 만들어 술을 빚고 15일 이상 저온 발효하여 예전옹기항아리모양의 고조리방식으로 내렸던 기술을 토대로 현대식증류기에 전통방식 그대로 상압(전통고조리방식)증류하고 저장고에 100일 이상 숙성 후 제품화하여 향이 구수하고 성상이 고유의 색택, 이미, 이취가 없으며 단맛, 쓴맛이 함께 느껴지는 것이 특징이다.",1.0,3.0,0.0,0.0,바디 
402,403,전통주,탁주,자연담은 복분자막걸리,대한민국,(농)국순당고창명주㈜,,"국내산 복분자(고창), 정제수",500,6.0,6~8 ℃,"전복버터구이, 삼게탕, 장어구이","고창산 쌀과 고창산 1등급 복분자로 빚은 고급막걸리로 국순당의 특허기술인 생쌀발효법으로 빚어 필수아미노산이 풍부하다. 복분자와 쌀이 혼합된 막걸리로 신선한 과실향에 부드럽게 올라오는 곡물향이 잘 섞여 있다. 단맛과 신맛 등 오미의 조화가 잘 갖춰져 있고, 막걸리를 살균하여 청량미는 적지만 맑은 산미가 입 전체를 깔끔하게 만든다.",4.0,2.0,2.0,1.0,당도 바디 산도 
403,404,전통주,증류주,로얄 안동소주,대한민국,(농)유토피아㈜,,국내산 쌀,360,45.0,6~8 ℃,통삼겹살찜과 잘 어울린다.,"고려후기 일본정벌 때문에 안동에 주둔한 원나라군이 군사용으로 빚었던 소주가 민간에 전래되어 내려온 것이 안동소주의 기원이다. 로얄 안동소주는 우리 쌀 100% 순곡주로 만들었으며 빨리 취하고, 빨리 깨며, 숙취가 없고 뒤가 깨끗하다. 15년간의 장기 숙성으로 원숙미의 증가와 더불어 새로운 고유의 향미가 형성되어 있다.",2.0,2.0,0.0,0.0,당도 바디 
404,405,전통주,약주·청주,지란지교,대한민국,(유)친구들의 술 지란지교,,"찹쌀,멥쌀,전통누룩(밀),정제수",600,17.0,6~8 ℃,"육전, 고기산적, 양념 불고기류와 잘 어울린다. ","순창에서 농사 지은 찹쌀과 멥쌀, 전통 누룩과 순창 암반수로 만든 생탁주로 일체의 첨가물 없이 빚어진 술이다. 술에 단맛과 산미가 조화로우며 목 넘김이 부드럽다. 신맛, 쓴맛, 단맛, 떫은 맛, 향기까지 다섯가지 오감의 맛이 난다.",3.0,3.0,4.0,2.0,당도 바디 산도 타닌 
405,406,전통주,탁주,지란지교 무화과 탁주,대한민국,(유)친구들의술지란지교,,"찹쌀, 멥쌀(국내산), 전통누룩(국내산 밀), 정제수, 무화과청, 레드비트분말, 밀함유",500,12.0,6~8 ℃,"갈치조림, 고등어무조림, 무화과타르트와 잘 어울린다.",100일 발표 90일 숙성으로 깊고 부드러운 맛과 순창에서 재배한 고품질 무화과와 햅찹쌀 100%를 사용해 무화과의 향긋함과 찹쌀의 달달한 맛이 특징이다.,4.0,4.0,3.0,2.0,당도 바디 산도 타닌 
406,407,전통주,약주·청주,지란지교 약주,대한민국,(유)친구들의술지란지교,,"찹쌀, 멥쌀(국내산), 전통누룩(국내산 밀), 정제수, 밀함유",500,17.0,6~8 ℃,"오징어초무침, 고등어김치찜, 연어포케와 잘 어울린다.","순창 지란지교 프리미엄 약주는 순창에서 재배되는 순창 햅찹쌀을 사용해 생산되는 순창의 지역특산주이며 무감미료, 무첨가 프리미엄 약주이다.",3.0,3.0,4.0,2.0,당도 바디 산도 타닌 
407,408,전통주,과실주,꽃 와인,대한민국,264청포도 와이너리,,포도(92%(안동 청수 100%)),375,11.5,6~8 ℃,"해산물류, 피자, 파스타류",,3.0,3.0,3.0,0.0,당도 바디 산도 
408,409,전통주,과실주,인사이더 블루베리,대한민국,가나다라브루어리,,"사과, 정제수, 효모, 설탕, 블루베리, 구연산(산도조절제), 합성향료(블루베리향),베리류색소,이산화탄소",375,3.0,6~8 ℃,"샌드위치, 치즈와 크래커, 핑거푸드, 해산물 요리",,5.0,2.0,3.0,0.0,당도 바디 산도 
409,410,전통주,탁주,가야 프리미엄 막걸리,대한민국,가야양조장,,김해 쌀(100%),500,6.0,6~8 ℃,돼지고기김치찜,,3.0,4.0,2.0,0.0,당도 바디 산도 
410,411,전통주,탁주,님 그리다,대한민국,가야양조장,,"찹쌀, 멥쌀, 누룩(밀)",750,6.0,6~8 ℃,"해물탕, 누룽지탕처럼 맑은탕 종류",,3.0,2.0,3.0,0.0,당도 바디 산도 
411,412,전통주,과실주,포엠 로제와인,대한민국,갈기산농업회사,,"포도, 설탕, 효모, 메타중아황산나트륨, 소르빈산칼륨",750,12.0,6~8 ℃,"바질파스타, 부라타치즈샐러드, 치즈류, 해물찜",,4.0,3.0,3.0,0.0,당도 바디 산도 
412,413,전통주,과실주,포엠 화이트와인,대한민국,갈기산농업회사,,"포도, 백설탕, 효모",750,12.0,6~8 ℃,"담백한 광어, 우럭 및 조개찜",,2.0,2.0,3.0,0.0,당도 바디 산도 
413,414,전통주,과실주,로제와인,대한민국,갈기산포도농원,,포도(국내산),750,12.0,8~12 ℃,"바질파스타, 부라타치즈 샐러드, 치즈류, 해물찜",,3.0,3.0,3.0,0.0,당도 바디 산도 
414,415,전통주,증류주,모리,대한민국,강산명주,,"정제수, 보리증류원액",550,19.0,4 ℃,"대하구이, 버섯볶음, 한치회",,2.0,3.0,2.0,1.0,당도 바디 산도 
415,416,전통주,탁주,연희유자,대한민국,같이양조장,,"멥쌀, 찹쌀, 유자",375,10.0,6~8 ℃,기름지거나 비린 음식,,3.0,0.0,2.0,0.0,당도 산도 
416,417,전통주,탁주,연희장미,대한민국,같이양조장,,"정제수, 멥쌀, 찹쌀, 누룩, 장미",375,10.0,6~8 ℃,중국음식,,2.0,0.0,2.0,0.0,당도 산도 
417,418,전통주,탁주,연희민트,대한민국,같이양조장,,"정제수, 멥쌀, 찹쌀, 누룩(밀함유), 민트",375,9.0,6~8 ℃,파스타와 크림 리조또,,4.0,0.0,4.0,0.0,당도 산도 
418,419,전통주,탁주,연희매화,대한민국,같이양조장,,"찹쌀, 누룩, 정제수, 매화",375,12.0,6~8 ℃,훈제연어와 치즈 플레이트,,1.0,0.0,2.0,0.0,산도 
419,420,전통주,리큐르/기타주류,산내울 사과애주,대한민국,거창사과원예농협,,"사과, 설탕, 주정, 정제수, 과당",375,16.0,10~12 ℃,"해물찜, 닭볶음탕",,3.0,2.0,2.0,0.0,당도 바디 산도 
420,421,전통주,리큐르/기타주류,산내울 복분자주,대한민국,거창사과원예농협,,"복분자, 설탕, 주정, 정제수, 과당",750,16.0,10~12 ℃,"해물찜, 닭볶음탕",,2.0,2.0,1.0,0.0,당도 바디 
421,422,전통주,리큐르/기타주류,장수홍삼주,대한민국,경원리큐르,,국내산 인삼,750,25.0,10~12 ℃,"갈비찜, 양곱창전골 갈비찜",,0.0,1.0,0.0,3.0,타닌 
422,423,전통주,증류주,계룡백일주 40%,대한민국,계룡백일주,,"찹쌀, 백미, 누룩, 재래종국화꽃, 오미자, 진달래, 재래종 솔잎",750,40.0,6~8 ℃,"갈비구이, 생선회",,0.0,3.0,0.0,2.0,바디 타닌 
423,424,전통주,약주·청주,장보고의 꿈 황칠약주,대한민국,고금주조장,,"정제수, 경기미햅쌀(국내산 멥쌀), 국, 효모 (밀함유)",600,15.0,6~8 ℃,"생선회, 홍어회, 해조류, 삼계탕, 양념된 고기류, 나물류",,2.0,2.0,2.0,2.0,당도 바디 산도 타닌 
424,425,전통주,탁주,완도유자막걸리,대한민국,고금주조장,,"정제수, 완도쌀,소맥분,입국,효모,정제효소,유자즙,",500,6.0,6~8 ℃,"들기름 막국수, 돼지수육, 굴전",,3.0,2.0,0.0,0.0,당도 바디 
425,426,전통주,증류주,징기스칸,대한민국,고도리 와이너리,,레드와인,750,40.0,16 ℃,굴 요리와 잘 어울린다.,레드와인을 감압식 증류하여 38도로 만든 브랜디입니다. 미국 캘리포니아산 오크통에서 5년간 숙성하여 브랜디 마니아의 입맛에 맞추었다. 진한 스모키향과 연갈색 색깔은 소비자의 입맛을 유혹한다,0.0,5.0,2.0,4.0,바디 산도 타닌 
426,427,전통주,과실주,고도리 화이트와인 스위트,대한민국,고도리 와이너리,,거봉포도(영천),375,10.5,10~12 ℃,"조개구이, 닭가슴살, 흰 살 생선회와 잘 어울린다.",고도리 화이트와인 스위트는 농산물우수관리(GAP)인증 100% 친환경 거봉포도로 만들어진다. 포도의 당도가 가장 높은 10월말에 수확하여 별도의 당을 첨가하지 않고 순수 발효한 와인으로 풍부한 산미와 달콤한 과일향을 발산한다.,3.0,3.0,3.0,0.0,당도 바디 산도 
427,428,전통주,과실주,레드 와인 500,대한민국,고도리 와이너리,,친환경 거봉 포도,750,12.0,5 ℃,"돼지갈비, 갈비찜, 약간 스파이시한 한식이 잘 어울린다.",와이너리에서 자가 생산한 MBA(머루포도)를 11월 초 서리가 내릴 때 높은 당도의 포도를 수확하여 당을 첨가하지 않고 발효한 와인이다. 25도의 고온에서 발효되며 2차 젖산 발효를 거치면서 풍부한 아로마틱 향이 생성되고 1년의 오크숙성으로 깊은 오크향이 우러나와 부드럽고 과일향이 풍부하다.,2.0,2.0,1.0,0.0,당도 바디 
428,429,전통주,과실주,고도리 청수 와인,대한민국,고도리 와이너리,,포도(청수),500,10.5,6~8 ℃,"과일 샐러드, 고르곤졸라 피자, 흰살생선회와 잘 어울린다. ",GAP인증 청수 포도의 당도가 가장 높은 8월 중순에 수확하여 별도의 당을 첨가하지 않고 순수 발효한 와인으로 풍부한 산미와 달콤한 과일향을 발산하고 아로마틱한 부케향이 풍부한 청수 와인이다.,4.0,2.0,3.0,0.0,당도 바디 산도 
429,430,전통주,과실주,고도리 레드와인 스위트,대한민국,고도리 와이너리,,MBA 머루포도(영천),750,12.0,5 ℃,"육회, 수육, 불고기와 잘 어울린다.",고도리 레드와인 스위트는 농산물우수관리(GAP)인증 100% 친환경 MBA 머루포도로 만들어진다. 포도의 당도가 가장 높은 11월 초 서리가 내리기 시작하면 수확하여 별도의 당을 첨가하지 않고 순수 발효한 와인이다. ,2.0,2.0,1.0,0.0,당도 바디 
430,431,전통주,과실주,고도리 화이트와인 드라이,대한민국,고도리 와이너리,,거봉포도(영천),750,10.5,5 ℃,광어나 우럭 등 기름기가 적은 생선회와 잘 어울린다. ,고도리 화이트와인 드라이는 농산물우수관리(GAP)인증 100% 친환경 거봉포도로 만들어진다. 포도의 당도가 가장 높은 10월 말에 수확하여 별도의 당을 첨가하지 않고 순수 발효한 와인으로 풍부한 산미와 달콤한 과일향을 발산한다.,3.0,2.0,3.0,0.0,당도 바디 산도 
431,432,전통주,과실주,고도리 복숭아와인,대한민국,고도리 와이너리,,복숭아(경북 영천),750,6.5,5 ℃,"흰 살 생선요리, 찜 요리, 가벼운 샐러드, 디저트와 잘 어울린다. ","복숭아의 당도가 가장 높은 8월 말에 수확하여 별도의 당을 첨가하지 않고 순수 발효한 와인이다. 또한, 고도리 북숭아와인은 맑고 투명한 색에 은은한 복숭아 향이 풍겨 나오는 매력적인 와인으로 영천시에서 생산한 과실로 만든 또 하나의 역작이다.",4.0,2.0,4.0,2.0,당도 바디 산도 타닌 
432,433,전통주,과실주,고도리 로제와인,대한민국,고도리 와이너리,,거봉 포도,750,12.0,5 ℃,어느 음식에나 잘 어울린다.,"화사한 핑크빛 색감이 예쁜 로제 와인으로, GAP인증을 받은 거봉 포도를 10월 중순에 수확하여 포도 껍질을 2일 동안 주스에 침용하였다가 껍질을 분리하여 화이트처럼 발효시킨 와인이다.",2.0,2.0,3.0,1.0,당도 바디 산도 
433,434,전통주,과실주,고도리 아이스와인(아이스 375),대한민국,고도리 와이너리,,포도,375,12.0,5 ℃,"과일 케이크, 애플파이 등 디저트와 어울린다.","화려하고 풍부한 단맛의 디저트용 와인으로, 포도 알갱이가 얼어불을 때까지 기다렸다가 와인을 만들기 때문에 다른 와인에 비해 아이스와인은 들어가는 포도의 양이 많다 그만큼 귀한 와인으로 고급스러운 단맛과 진한 향을 선사한다.",4.0,1.0,1.0,0.0,당도 
434,435,전통주,과실주,고도리 샤인머스캣 화이트와인,대한민국,고도리 와이너리,,"샤인머스캣99%(국내산), 설탕, 효모, 소브산칼륨, 메타중아황산칼륨",375,10.5,5 ℃,"바질 파스타, 토스트, 루꼴라피자와 잘 어울린다. ",직접 농사지어 GAP인증받은 포도로 10월 중순 포도가 잘 익었을때 수확하여 당일 수확한 포도를 재경파쇄를 거쳐 발효 및 숙성시켜 만든 와인으로 샤인머스켓 특유의 향과 맛이 나는 와인이다.,2.0,2.0,3.0,1.0,당도 바디 산도 
435,436,전통주,증류주,고도리 징기스칸 브랜디,대한민국,고도리 와이너리,,머루포도,375,40.0,16 ℃,굴 요리와 잘 어울린다.,잘 숙성된 레드와인을 증류시켜 오크통에서 1년간 숙성을 거친 뒤 병입한 제품으로 향긋한 과일향과 깊은 오크향이 조화를 이루어 초주와 말주를 제거하여 숙취가 없고 맛이 깔끔합니다.,1.0,2.0,2.0,0.0,바디 산도 
436,437,전통주,과실주,고도리 아이스 와인 망고와인,대한민국,고도리 와이너리,,mba머루포도 효모 메타중아황사 설탕,375,12.0,5 ℃,"젤라또, 요거트, 초콜릿케이크, 한국식 다과 등 각종 디저트와 잘 어울린다.",청정지역 고경면 고도리에서 직접 재배한 MUSCAT BAILEY A(머루포도) 초겨울 포도를 따서 만든 고급와인으로 아직 국내수입이 80%가 캐나다산이지만 국내기술력으로 승화시켜 최고의 디저트와인이다. 포도밭에서 얼어있는 포도를 딴 다음 해동되기 전에 짜내서 만드는 맛 좋은 디저트 와인이다.,3.0,2.0,2.0,1.0,당도 바디 산도 
437,438,전통주,과실주,고도리 프룬와인,대한민국,고도리 와이너리,,"자두 99.585%, 설탕 0.4%, 효모 0.005%, 메타중아황산칼륨 0.005%, 솔빈산칼륨 0.005%",375,11.5,5 ℃,크림파스타와 잘 어울린다.,"서양자두 프룬으로 만들어진 고도리 프룬와인은 100% 프룬용액을 발효시켜 만들었습니다. -5도에서 냉동시킨 프룬을 압착기를 이용해 씨를 빼낸 후 프룬용액으로 만든 와인으로, 프룬 특유의 향과 새콤달콤한 감칠맛이 뛰어난 와인입니다.",3.0,2.0,3.0,1.0,당도 바디 산도 
438,439,전통주,증류주,꽃빛서리,대한민국,고창서해안복분자주,,"증류원액(백미, 생화20가지, 효모), 정제수, 주정, 결정과당, 구연산, L-아스파라긴산, 효소처리스테비아",375,17.2,6~8 ℃,해산물,"꽃빛서리는 국내산 백미와 국화, 산수유, 매화 등 20가지 생화를 넣어 양조한 밑술을 증류해 만들어진 소주이다. ‘꽃의 향기와 맛이 서리처럼 내리다’라는 이름처럼, 생화의 향이 가득하다. 전통 소주의 특성상 깔끔한 맛과 부드러운 목 넘김이 특징이며, 혼합된 불순물이 거의 없어 숙취가 적다.",3.0,2.0,1.0,0.0,당도 바디 
439,440,전통주,과실주,고창선운산 땡큐블루베리주,대한민국,고창선운산,,"블루베리과실, 주정, 효모, 구연산, 정제수",360,13.0,5 ℃,스테이크와 잘 어울린다.,블루베리주는 고창군 심원면 황토 지역에서 서해안 해풍(海風)을 맞고 자란 블루베리 중 당도와 과육이 뛰어난 1등급 수확 분으로 빚어 단맛과 신맛이 조화를 이루어 블루베리 고유의 맛과 향이 뛰어나다. 비교적 낮은 알코올도수 13%로 와인처럼 가볍게 즐길 수 있는 제품이다.,3.0,2.0,0.0,0.0,당도 바디 
440,441,전통주,과실주,쿨샷 7.5,대한민국,고창선운산,,"복분자과실, 주정, 효모, 구연산, 정제수",300,7.5,5 ℃,디저트,"""쿨샷7.5""는 고창군 심원면 황토 지역에서 서해안 해풍(海風)을 맞고 자란 복분자 중 당도와 과육이 뛰어난 1등급 수확 분으로 빚어 단맛과 신맛이 조화를 이루어 복분자 고유의 맛과 향이 뛰어나다. 쿨샷7.5 한 병에는 55알의 햇복분자에서 착즙한 과즙이 들어있어 천연과즙음료를 마시는 것처럼 복분자주를 가볍게 즐길 수 있게 만든 제품이다.",3.0,2.0,2.0,0.0,당도 바디 산도 
441,442,전통주,과실주,고창선운산 복분자주 특1호,대한민국,고창선운산,,"복분자과실, 주정, 효모, 구연산, 정제수",1800,15.0,10~12 ℃,장어구이,고창선운산에서 생산하는 고창선운산 복분자주는 고창군 심원면 황토 지역에서 서해안 해풍(海風)을 맞고 자란 복분자 중 당도와 과육이 뛰어난 1등급 수확 분으로 빚어 단맛과 신맛이 조화를 이루어 복분자 고유의 맛과 향이 뛰어나다. 붉은 흑진주처럼 술 빛이 매혹적이다. 아주 미세하게 쓴맛이 있지만 다른 복분자주에 비해 전체적으로 단맛이 중심을 잡고 있어 누구라도 편하게 마실 수 있다.,3.0,3.0,1.0,1.0,당도 바디 
442,443,전통주,과실주,고창선운산 땡큐복분자주,대한민국,고창선운산,,"복분자과실, 주정, 효모, 구연산, 정제수",300,13.0,10~12 ℃,장어구이,고창선운산에서 생산하는 고창선운산 땡큐복분자주는 고창군 심원면 황토 지역에서 서해안 해풍(海風)을 맞고 자란 복분자 중 당도와 과육이 뛰어난 1등급 수확 분으로 빚어 단맛과 신맛이 조화를 이루어 복분자 고유의 맛과 향이 좋다. 붉은 흑진주처럼 술 빛이 매혹적이다. 아주 미세하게 쓴맛이 있지만 다른 복분자주에 비해 전체적으로 단맛이 중심을 잡고 있어 누구라도 편하게 마실 수 있다.,3.0,3.0,1.0,1.0,당도 바디 
443,444,전통주,약주·청주,동학 1957,대한민국,고헌정영농조합법인,,"국내산 쌀, 구연산, 효모, 젖산, 정제효소제, 국, 주정, 정제수",375,13.0,10~12 ℃,"들깨수제비, 궁중 떡볶이, 된장찌개","""동학1957""은 물맑은 충주에 자리잡은 고헌정영농조합법인에서 만든 청주이다. 2014년부터 호주 등 해외로 수출하고 있으며 2018년에는 평창 동계올림픽 공식 판매주로 선정되어 세계인의 입맛을 사로잡았다. 품질 좋은 국내산 쌀로 빚어 저온 냉동여과하여 숙성한 제품으로 쌀의 풍미가 한층 살아 있는 술이다.",2.0,2.0,4.0,3.0,당도 바디 산도 타닌 
444,445,전통주,탁주,골목막걸리 프리미엄 12,대한민국,골목양조장,,"정제수, 쌀(국내산), 국, 효모",350,12.0,6~8 ℃,고기,"골목막걸리는 SBS 백종원의 골목식당을 인연으로 외식전문가 백종원 대표와 양조연구가 박유덕 사장이 콜라보레이션하여 만들어낸 프리미엄 막걸리이다. 품질 좋은 예산 쌀로 만들었으며, 인공감미료를 첨가하지 않아 쌀 본연의 단맛을 잘 느낄 수 있다.",5.0,4.0,3.0,0.0,당도 바디 산도 
445,446,전통주,탁주,과천미주,대한민국,과천도가,,"정제수, 경기미햅쌀(국내산 멥쌀), 국, 효모 (밀함유)",500,9.0,6~8 ℃,"해산물, 육전, 소꼬리찜, 치즈",맑은 샘물처럼 감미로운 우리 쌀 술. 지게미를 최소화하여 귀하게 빚었다. 하루의 피로를 씻어주고 몸의 평화를 회복하는 홈술로 추천한다. 맑고 차갑게 드시고 마지막에 흔들어 청탁의 매력을 즐길 수 있다.,4.0,3.0,3.0,0.0,당도 바디 산도 
446,447,전통주,탁주,광양 생 막걸리 골드,대한민국,광양주조공사,,"정제수, 쌀(국산100%), 입국(국산), 곡자(국산누룩), 아스파탐(감미료, 페닐알라닌 함유), 정제효소, 효모, 젖산, 액화효소",750,5.0,6~8 ℃,"치킨, 피자, 치즈 ","한국식품연구원에서 개발된 국산효모로 만든 막걸리로 햅쌀, 토종 앉은뱅이 밀누룩 등 국내산 좋은 재료를 100% 사용하여 목 넘김이 부드럽고 깔끔한 맛이 살아있는 프리미엄 쌀 막걸리다.",3.0,3.0,2.0,1.0,당도 바디 산도 
447,448,전통주,탁주,광양 생 막걸리,대한민국,광양주조공사,,"정제수, 쌀(국산100%), 입국(국산), 곡자(국산누룩), 아스파탐(감미료, 페닐알라닌 함유), 정제효소, 효모, 젖산, 액화효소",750,5.0,6~8 ℃,"전, 두부김치, 골뱅이 소면무침 ",국산 햅쌀을 사용한 목 넘김이 부드럽고 깔끔한 맛이 살아있는 막걸리이다. 가장 대중적인 맛으로 빨간 뚜겅 광양막걸리 이미지로 고객들의 꾸준한 사랑을 받았다.,3.0,3.0,2.0,1.0,당도 바디 산도 
448,449,전통주,약주·청주,경주교동법주,대한민국,교동법주,,찹쌀(국내산),900,16.0,6~8 ℃,쇠고기육포,"350년 이상의 전통을 가진 찹쌀로 빚은 약조로 기능보유자가 직접 손수 빚는 중요무형문화재 술 이다. 모두 수작업으로 이루어지므로 생산되는 양이 적다. 경주교동법주는 찹쌀로 빚은 청주라 부르기도 하는데 청주는 예로부터 겨울 술이라 하여 교동법주 역시 여름에는 술을 빚지 않는다. 찹쌀 특유의 쌉싸름한 맛과 단맛, 신맛을 느낄 수 있으며 누룩 향과 본연의 독특한 향이 잘 어우러져 있다. 술에 어떠한 처리도 하지 않기 때문에 살아있는 술로 반드시 냉장보관 해야 하며 차게 해서 먹는 것이 훨씬 좋다.",1.0,3.0,1.0,0.0,바디 
